12,"Lana Van Niekerk, Zelda Coetzee, Madri Engelbrecht, Zerina Hajwani, Susan Landman, Mapheyeledi Motimele, Santie Terreblanche.","Supported employment: Recommendations for successful 
implementation in South Africa",South African Journal of Occupational Therapy,2011,South Africa,Africa,"To report on the findings of a descriptive qualitative study in which supported employment (SE), as a potential 
strategy to facilitate the employment of persons with disability in the open labour market in South Africa, was explored.","To provide a  brief description of SE and its success in other countries and to discuss the challenges faced in South Africa that might prevent its successful 
implementation.","Service providers who had initiated SE programmes in the Cape 
Metropole; eight participants employed by government, the NGO 
sector and two universities in the Western Cape.",Not stated ,Not stated,Not stated ,Not stated,Social model of Disability,Not applicable ,urban ,Not stated,not stated,not stated,SE service providers,Not stated, SE Service providers,Focus group interview,Supported employment,Not stated,Competitive employment should always be the ultimate outcome. A client-centered approach should be used. Support should be provided to ensure long-term sustainability employment. Support consumer goals and empower them with choices and information. No more support than needed and no less than necessary. ,"Job finding, job analysis, job matching, job coaching. On-going support that is determined by the worker's individual needs. Protective and sheltered workshops.","SE achieve participation in competitive employment. Participants in SE earned more and worked more hours per month than those who had  had prevocational training. Person with disabilities have an opportunity to be an active and contributing member of the society. Lessen the économic burden the government. Positively influence the disabled person's health and well-being. Provided income, personal development, provided arina for social development, self esteem and identity. Integration of persons with disability into mainstream society.","The authors propose SE as a model of choice to drive the process of economic empowerment for persons facing disabling conditions. In developing a SE model suitable for South Africa, funding and infrastructure should be used in such a way that integrated career management is a viable option for persons with disability.  A holistic 
approach is needed because components of SE, such as the assess ment of work skills, placement in suitable work and reasonable accommodation do not necessarily follow a linear process.",The extent to which the receipt of a disability grant impacts on someone’s access and/or commitment to the process of SE requires thorough investigation; research in this area should be undertaken.,Not stated 
13,"Lana Van Niekerk, Zelda Coetzee, Madri Engelbrecht, Zerina Hajwani,  Santie Terreblanche.","Time utilisation trends of supported
employment services by persons with mental
disability in South Africa",Work ,2015,South Africa,Africa," To determine the feasibility
of supported employment (SE) as a strategy with which to facilitate the employment of persons with disability in competitive
work contexts.","To describe the components of SE utilised by persons with mental disability (i.e. psychiatric or intellectual
disability) in terms of type and time utilisation patterns over 12 months", People with mental disabilities receiving SE in the Western Cape Province,"Criterion sampling, a form of purposive sampling","Group A 29, Group B 56.",Not stated,Not stated,Not stated,"Intellectual disability, Psychiatric disability (Schizophrenia, Schizoaffective disorder, Bipolar I).",Urban ,Not stated,Not stated,Low socio-economic group,Supported employment, limited education (mainly special education and left school without an academic qualification).,"Individuals were employed in entry level jobs in the open labour market including cleaners, laundry assistants, assistant carers, basic assemblers, garden ers and assistant grounds men. Employment contracts varied between fixed term contracts and permanent employment. Permanent jobs obtained by individuals in Programme A included vegetable farming, paper making, food production and book packaging.",longitudinal descriptive design,Supported employment (SE) is a return-to-work strategy promoting the inclusion of persons with dis abilities in competitive employment environments. Prepare work placement. Work visit.,Not stated,On-going support. Individualised support. Advocacy.,"Job finding, Job analysis, Job matching and Job coaching. Reasonable accommodation. On-going support. Protective workshops. Non-job advocacy. Personal life skills. Simulated work. Trial placement, Person-centred instructional plans, Job advocacy - at job site with employers. Job advocacy - co-workers (and customers).  Evaluation of employment potential. Evaluation of goodness of job fit.  Work visit to observe real work. Work visit to discuss reasonable accommodation. Work visit to assist with performance appraisal.",To achieve employment outcomes for people with mental disabilities. Integration of mental health service users in the workplace.,"SE services can be considered as a viable option for return to work in resource-constrained environments. Providers of SE services will need to modify approaches in order to meet contextual realities. Because the bulk of costs associated with SE are in the remuneration of service providers, understanding the number of provider hours necessary will be an important consideration for employers in middle income countries who are concerned with the feasibility of SE.","Despite strong evidence for the effectiveness of SE services internationally, similar research is needed in middle-income countries where a more modest suite of SE services may be feasible. We therefore recommend that research is conducted to determine effectiveness over the longer term and including more impairment categories.  It seems feasible to offer SE in resource constrained environments; however, further studies are needed to determine actual costs of service provision given various contextual considerations.","Psychiatric hospital in Cape Town (clients from forensic wards, general wards and the outpatient department)."
